{"schemaVersion":1,"id":"hungaroring","name":"Hungaroring","points":[[-369.8,-274.6],[-628.5,-68.8],[-637,-51],[-636.1,-41],[-632.1,-33.2],[-618.8,-24.3],[-607.7,-22.6],[-545.5,-23.8],[-514.9,-29],[-486.9,-37.3],[-457.6,-48.9],[-418.6,-73],[-255.6,-202],[-243.7,-208.2],[-220.6,-210.9],[-201,-204],[-193.1,-197.8],[-182,-183.6],[-178,-174.2],[-177.1,-153.7],[-183.7,-133.8],[-230.3,-54.7],[-235.2,-40],[-236.1,-28.4],[-229.9,-6],[-82.5,293.4],[-66.1,322.7],[-23,376.2],[-14.5,391.9],[-13.7,400.8],[-58,568],[-58.9,580],[-54.5,603.2],[-49.6,614.2],[-30.1,631],[-19,636.6],[5.9,638.3],[35.2,628.3],[97.3,584.3],[202.5,471.1],[206.5,462.2],[207.4,447.9],[190.1,429.1],[187.9,423.9],[188.3,414.5],[221.6,287],[228.2,271.4],[244.7,254],[267.8,248.3],[332.1,238.9],[345.5,233.7],[361,222.1],[367.2,212.1],[372.1,192.7],[372.1,181.2],[353.9,56],[354.8,23.4],[363.3,-2.3],[426.3,-102.9],[432.5,-118],[434.3,-138.5],[430.7,-159.5],[419.1,-178.3],[214.5,-411.6],[181.7,-448.3],[173.6,-453],[159,-453],[152.8,-449.3],[80.9,-369.1],[20,-317.8],[2.3,-309.4],[-8.4,-307.9],[-17.7,-308.9],[-30.1,-314.6],[-37.6,-323],[-46.1,-339.8],[-45.7,-360.8],[-41.2,-370.7],[-35.5,-378.6],[81.8,-475],[91.1,-496.6],[92.9,-511.2],[91.5,-524.8],[81.8,-547.4],[73.4,-556.8],[59.6,-565.7],[45.4,-571.5],[29.9,-573.6],[13.4,-571.5],[-1.3,-565.7],[-15,-556.3]],"lengthM":4374,"sectors":null,"source":{"name":"bacinger/f1-circuits","url":"https://github.com/bacinger/f1-circuits/blob/master/circuits/hu-1986.geojson","license":"MIT","upstreamId":"hu-1986","note":"Centre-line only. No elevation, sector boundaries, race direction or start/finish index in the source."}}
