{"schemaVersion":1,"id":"yas-marina","name":"Yas Marina Circuit","points":[[-12.9,68.2],[226.7,100.6],[239.3,104.9],[248.8,114.8],[255.4,128.4],[256.6,142],[214.7,319.3],[208.2,337],[199.2,350.2],[184.2,362.7],[171.6,369],[103.7,390.1],[64.3,413],[49.2,427.3],[29.2,452],[18.9,476.7],[15.2,495.5],[14.9,516],[19,540.2],[43.6,630.5],[49.6,678.5],[50.2,712.7],[13.5,1001.3],[11.2,1010.3],[4,1019.6],[-8.2,1029.7],[-24.1,1033.1],[-40.9,1028.3],[-47.4,1021.8],[-56.3,1005.4],[-71.2,961.2],[-85.3,897.1],[-297.3,264.5],[-317.5,190.3],[-360.3,53.5],[-405.9,-81.7],[-405.9,-95.9],[-401.3,-101.2],[-391,-101.5],[-344.4,-97],[-337.7,-105.1],[-311.5,-202.8],[-297.9,-236.9],[-285.4,-261.4],[-258.6,-300.4],[-228,-336],[-189.6,-369],[10.6,-527.8],[39.9,-548.7],[112.4,-593.3],[289.6,-676.5],[321.1,-689.2],[338.8,-689.3],[357.5,-685.5],[374.6,-675.6],[389.8,-658.2],[399.3,-632.9],[401.4,-621.3],[399.7,-602.2],[390.4,-574.9],[382.4,-562.9],[357,-542.5],[342.2,-535.9],[320.5,-532.8],[148.9,-519],[118.6,-514.3],[109,-510.8],[7.5,-446.2],[1.2,-438.2],[-5.5,-421.1],[-26.9,-320.7],[-25.5,-312.8],[-20.6,-307.4],[-13.1,-305.3],[63.4,-293.9],[78.2,-287.1],[84.3,-280.9],[90.4,-269.4],[91.8,-255.3],[92,-185.8],[86.4,-173.9],[79.5,-166.8],[69.1,-162.8],[25.8,-157.4],[-150.3,-183.2],[-181.6,-183.6],[-210.4,-176.7],[-226.3,-160.9],[-297.6,-33.9],[-302,-7.3],[-302.2,7.4],[-299.8,17.4],[-293.9,24.6],[-286.6,28.3],[-269.9,31.3]],"lengthM":5291,"sectors":null,"source":{"name":"bacinger/f1-circuits","url":"https://github.com/bacinger/f1-circuits/blob/master/circuits/ae-2009.geojson","license":"MIT","upstreamId":"ae-2009","note":"Centre-line only. No elevation, sector boundaries, race direction or start/finish index in the source."}}