{"schemaVersion":1,"id":"barcelona","name":"Circuit de Barcelona-Catalunya","points":[[320.1,114.1],[-44.7,-467.6],[-60.2,-483.1],[-66.5,-486],[-77.8,-487.5],[-95.8,-484.8],[-137.1,-460.7],[-163.6,-457.5],[-180.4,-461.1],[-190,-467.1],[-261.6,-520.6],[-295.7,-534.1],[-320.1,-536.1],[-346.3,-533.6],[-375.9,-521.3],[-398.7,-502.3],[-417,-478.3],[-426,-459.7],[-432.5,-439],[-435.8,-407.1],[-432.7,-369.3],[-416.5,-313.5],[-407.3,-293.9],[-273.2,-80.7],[-255.3,-67.6],[-235.9,-62.8],[-213.6,-67.3],[-202.2,-73.7],[-180.9,-93.6],[-170.9,-113.6],[-167.3,-128.8],[-166.3,-152.2],[-170.6,-182],[-189.8,-221.4],[-280.1,-362.5],[-282.8,-380.4],[-276.4,-397.3],[-264.6,-408.1],[-255.7,-411.2],[-248.7,-412.4],[-237.4,-410.2],[-96.4,-346.7],[-77.6,-335],[-40.1,-302.9],[-26.8,-286.8],[27.2,-202],[35.5,-180.6],[33.3,-166.7],[26.4,-154.2],[15.7,-144.3],[-8.9,-129.8],[-22.3,-118.9],[-41.1,-92.6],[-113.6,79.5],[-116.6,95.2],[-116.6,111.2],[-112.6,135.4],[-105,149.2],[-86.7,172.2],[-74.3,181.9],[357.5,403.4],[372.6,412],[380.5,420.4],[384.3,428.5],[385.3,438.3],[382.3,449.2],[377.2,457.9],[359.2,473.1],[331.3,483.3],[304,485.8],[277.4,481.5],[258.1,472.1],[244.8,464.5],[208.1,435.1],[195.4,429.4],[175.9,428],[164.2,430.5],[150.3,437.7],[139.2,447],[126.7,470.1],[124.4,489.9],[128.3,507.7],[135.1,520.4],[258.8,624],[283.3,635.7],[315.5,638.7],[330.1,635.7],[342.1,630.6],[483.3,540.2],[503.4,523.3],[516.2,502.7],[523.6,474.4],[523.8,454.7],[520.9,437],[506.7,408.9]],"lengthM":4661,"sectors":null,"source":{"name":"bacinger/f1-circuits","url":"https://github.com/bacinger/f1-circuits/blob/master/circuits/es-1991.geojson","license":"MIT","upstreamId":"es-1991","note":"Centre-line only. No elevation, sector boundaries, race direction or start/finish index in the source."}}
