{"schemaVersion":1,"id":"spa","name":"Circuit de Spa-Francorchamps","points":[[-256.9,1060],[-370.3,1258.2],[-371.5,1267.1],[-366.5,1275],[-356,1278.6],[-344.3,1275.4],[-216.4,1213.1],[-172.8,1186.3],[-127.5,1152.8],[-86.9,1118.7],[-54.6,1083.6],[118.5,877.1],[130.7,865.5],[188.9,828.4],[205.3,812.2],[219.1,790.2],[228,770.1],[233.8,747.7],[238.9,706.2],[246.8,678],[396.5,436.3],[421.2,379.7],[630,-346.8],[631.3,-360.9],[628.7,-376.6],[620.3,-389.2],[608.2,-399.7],[592.7,-408.1],[583.4,-417],[577.1,-427.4],[572.1,-443.2],[573,-458.9],[593.9,-552.8],[593.5,-569],[590.2,-583.7],[578.8,-599.9],[565.4,-610.9],[326.5,-776],[311.4,-782.4],[296.3,-782.8],[280.4,-778.1],[267.3,-768.7],[258.1,-755.1],[254.4,-741.5],[253.5,-726.8],[258.1,-713.1],[266.5,-699],[278.7,-689.1],[383.1,-624.6],[394.4,-613],[400.6,-601.5],[403.2,-587.9],[401.9,-571.1],[358.7,-444.2],[345.3,-392.4],[314.7,-232.5],[299.6,-140.8],[296.3,-125.1],[288.7,-108.3],[278.7,-94.6],[263.6,-80],[246.8,-68.9],[228.4,-61.6],[146.6,-54.3],[122.7,-56.9],[78.7,-72.6],[60.7,-84.7],[39.7,-104.1],[26.3,-123.4],[11.7,-151.2],[-100.3,-430.7],[-111.6,-451.1],[-125,-465.2],[-143.4,-475.7],[-161.9,-480.9],[-179.1,-481.5],[-196.3,-477.8],[-235.3,-455.2],[-251.2,-448.5],[-270.5,-445.3],[-289.8,-447.5],[-307.4,-453.1],[-322.5,-463.7],[-343.9,-491.9],[-440.7,-643.9],[-450.3,-652.8],[-462.1,-659.2],[-476.3,-662.3],[-492.3,-661.3],[-506.1,-654.9],[-610,-579],[-629.7,-551.2],[-639.8,-519.2],[-640.6,-501.4],[-637.7,-479.9],[-609.2,-402.3],[-586.6,-361.9],[-561.8,-326.8],[-524.1,-284.4],[-461.2,-223.1],[-424.3,-194.3],[-231.1,-91.5],[-207.6,-76.8],[-164.8,-40.1],[-130.9,2.9],[-109.1,43.1],[-44.1,191],[-39.9,211.9],[-39.1,238.2],[-43.3,261.8],[-124.6,475.1],[-140.1,543.7],[-147.7,607.7],[-156.9,743.4],[-155.2,752.3],[-149.7,758.7],[-141.4,760.8],[-127.2,758.7],[-102.4,760.8],[-95.7,768.1],[-94,776.5],[-98.2,787.5],[-149.7,871.9]],"lengthM":6977,"sectors":null,"source":{"name":"bacinger/f1-circuits","url":"https://github.com/bacinger/f1-circuits/blob/master/circuits/be-1925.geojson","license":"MIT","upstreamId":"be-1925","note":"Centre-line only. No elevation, sector boundaries, race direction or start/finish index in the source."}}
