{"schemaVersion":1,"id":"baku","name":"Baku City Circuit","points":[[1040.5,411],[1190.9,475.5],[1198.9,481.9],[1204,491.2],[1205,500.2],[1202.4,513.2],[1171.9,592.4],[1120.2,692.6],[1077.6,789.5],[1070.5,794.2],[1061.6,795.8],[741.6,670],[294.3,467.2],[280.8,452.9],[280.8,433.6],[348.5,258],[349,244.3],[338.5,232.3],[220.6,176.7],[154,140],[64.2,82.4],[58.7,75.1],[60.7,64.5],[75.7,31.6],[75.2,22.2],[33.6,-15.1],[-171,-173.4],[-205.6,-204.8],[-220.2,-214.8],[-234.7,-214.2],[-246.8,-201.1],[-300.9,-41.8],[-307.4,-35],[-330.5,-32.9],[-350,-20.9],[-362.1,-17.7],[-386.6,-19.3],[-399.7,-14.1],[-406.2,-4.1],[-417.7,33.6],[-431.3,45.7],[-443.3,46.3],[-529.5,16.4],[-667,-50.8],[-757.7,-105.3],[-775.7,-119.9],[-789.8,-138.7],[-802.8,-165.5],[-847.4,-317],[-850.5,-337.4],[-835.9,-546.6],[-831.4,-559.7],[-820.4,-572.7],[-634.3,-670.2],[-553.6,-703.8],[-537.6,-706.4],[-519,-703.3],[-506,-694.4],[-497.4,-684.9],[-428.2,-557],[-413.2,-537.7],[-253.3,-391.9],[-240.2,-373.6],[-233.7,-355.8],[-219.6,-259.8],[-213.6,-241],[-201.6,-223.1],[42.6,-31.9],[73.7,-11.4],[141.4,23.2],[245.2,66.7],[337.5,109.7],[562.6,206.1],[653.9,247.6],[887.5,347.1]],"lengthM":5942,"sectors":null,"source":{"name":"bacinger/f1-circuits","url":"https://github.com/bacinger/f1-circuits/blob/master/circuits/az-2016.geojson","license":"MIT","upstreamId":"az-2016","note":"Centre-line only. No elevation, sector boundaries, race direction or start/finish index in the source."}}
