{"schemaVersion":1,"id":"sepang","name":"Sepang International Circuit","points":[[-147,-24.2],[-446.8,-48.8],[-460.5,-47.7],[-473,-41.5],[-481.5,-32.5],[-486.2,-20.3],[-486.7,-6.5],[-481.7,8],[-470.1,18.9],[-454.3,23.9],[-435.9,20.2],[-401.7,8],[-390.2,9.9],[-380.6,19.4],[-377.5,31.1],[-380.6,46.5],[-414.1,90.6],[-424,108.1],[-430.4,128.7],[-433.5,149.5],[-433.5,173.1],[-427.9,231.1],[-418.8,258.4],[-404.4,286.2],[-390,304.1],[-367.8,324.2],[-344.5,339.6],[-182.8,393.4],[-80,433.9],[48.4,490],[59.8,489.6],[69.7,483.3],[92.4,364.2],[120.5,242.7],[132.5,217],[145.9,198.7],[169,180.2],[191.9,168],[214.6,162.3],[237,161.3],[262.4,165.2],[288.4,175.3],[306.8,188.6],[342.8,227.1],[360.5,237.8],[388.2,247.4],[411.9,248.2],[435.2,245],[454.1,237.3],[471,223.8],[672.6,-6.1],[673.7,-17.4],[669,-30.2],[634.7,-107.2],[624.4,-114.4],[612.1,-117.3],[428.1,-128],[255.3,-148.3],[160.6,-163.8],[151.6,-171.2],[148.7,-183.3],[156.7,-196.8],[224.2,-234.2],[239,-249.1],[249.3,-271.1],[254.5,-294],[253.7,-326.7],[243.2,-381],[227.1,-415.2],[203,-450.3],[189.8,-458.6],[177.1,-460.7],[162.8,-458],[151.3,-450.6],[-59.8,-276.6],[-74.6,-271.1],[-93.6,-270],[-114.3,-275.2],[-191.3,-314.7],[-211.9,-321.2],[-236.3,-324.5],[-257.7,-324.3],[-297.7,-317],[-324.9,-305.8],[-342.6,-291.8],[-366.2,-260.7],[-374.6,-237.3],[-375.8,-223.1],[-365.9,-207.1],[-344.7,-198.3],[492.6,-44.3],[504.6,-33.7],[513.4,-13.5],[509,3.4],[493.7,19.2],[468.8,23.1]],"lengthM":5549,"sectors":null,"source":{"name":"bacinger/f1-circuits","url":"https://github.com/bacinger/f1-circuits/blob/master/circuits/my-1999.geojson","license":"MIT","upstreamId":"my-1999","note":"Centre-line only. No elevation, sector boundaries, race direction or start/finish index in the source."}}
