{"schemaVersion":1,"id":"mexico-city","name":"Autódromo Hermanos Rodríguez","points":[[-479.8,386.3],[-5.7,321.4],[116.6,310.3],[327.6,281.5],[592.6,242.2],[647.3,231.2],[661.6,223.3],[664.7,210.3],[654.7,144.7],[656,138.9],[659.1,133.7],[695.1,114.3],[699.4,107.5],[693.9,60.3],[685.2,23.6],[671.5,-12],[656,-44],[534.3,-250.5],[379.1,-495.3],[377.9,-504.7],[379.7,-512.6],[384.1,-518.4],[431.9,-549.3],[432.5,-556.1],[429.5,-561.9],[340.6,-630],[325.7,-634.7],[304.6,-623.1],[302.1,-616.9],[302.1,-604.3],[339.4,-313.9],[338.8,-305],[329.5,-289.8],[277.4,-256.8],[252.5,-233.2],[233.2,-189.1],[223.4,-173.5],[212.1,-162.5],[183,-147.2],[48.8,-126.8],[34,-122.1],[20.3,-109],[-0.8,-47.7],[-15,-27.2],[-136.1,39.4],[-164.7,51.4],[-206.2,61.4],[-539,109.6],[-545.8,112.2],[-552.6,123.2],[-558.8,217.6],[-565.6,276.8],[-568.2,283.5],[-573.1,288.3],[-579.9,291.4],[-588.6,290.4],[-598,282],[-609.8,264.2],[-624.7,255.9],[-633.9,256.3],[-668.7,270.5],[-725.2,276.8],[-734.5,279.9],[-742.6,290.4],[-743.2,297.2],[-739.5,313.5],[-731.5,334.9],[-705.3,374.3],[-687.3,389],[-664.3,400.5],[-643.3,406.2],[-622.8,406.7],[-593,403.1]],"lengthM":4300,"sectors":null,"source":{"name":"bacinger/f1-circuits","url":"https://github.com/bacinger/f1-circuits/blob/master/circuits/mx-1962.geojson","license":"MIT","upstreamId":"mx-1962","note":"Centre-line only. No elevation, sector boundaries, race direction or start/finish index in the source."}}
