{"schemaVersion":1,"id":"albert-park","name":"Albert Park Circuit","points":[[-150.7,-424.6],[-379.9,-193.7],[-382.6,-178.4],[-368.5,-149.9],[-361.2,-112.2],[-360.6,-97],[-365.3,-67.3],[-371.1,-52.2],[-380.1,-36.4],[-390.8,-23.7],[-481.6,63.4],[-548.7,135.1],[-625.2,233.2],[-651.5,274.4],[-702,362.8],[-722,406.2],[-721,416.5],[-716.7,423.8],[-706.1,429.2],[-603,449.2],[-590.3,455.5],[-586.9,460.2],[-582,474.8],[-581,490.1],[-587.2,670],[-586,674.1],[-571.7,690.8],[-458.4,773.1],[-436.2,785.9],[-293.6,842.3],[-231.3,880],[-209.7,882.2],[-200.8,877],[-175,850.7],[-155.7,837.1],[-131.1,827.8],[-46,818.9],[-18.8,809.5],[5.2,798],[49.7,762.3],[67.5,739.1],[84.2,710.2],[93.6,680.7],[99.5,657.9],[126.7,506.4],[126.9,489.8],[124.2,469.9],[110.1,432.2],[70.1,378.8],[57.1,349.9],[25.1,186.7],[21.8,147.8],[23.5,93.3],[27.5,66],[44.2,4.5],[68.6,-45.6],[103.2,-98.5],[131,-128],[237.2,-220.9],[260.9,-233.1],[280.3,-239],[378.7,-239.3],[393.1,-242.9],[407.5,-249.9],[417.3,-255.4],[574,-389],[606.1,-427],[621,-450.7],[636.1,-485.8],[651.2,-529.9],[691.3,-668.4],[715.2,-756.5],[722.4,-793.3],[722.6,-800.9],[716.3,-804.2],[514.3,-884.9],[495.5,-888.1],[481.3,-887.1],[466.8,-881.1],[443.3,-863.2],[379.8,-748.5],[342,-687.2],[337.3,-683],[324.7,-680.9],[319.1,-684.1],[259.2,-751.9],[241.9,-765.5],[220.6,-772.3],[211.7,-772.2],[186.1,-764.8],[170.8,-752.8]],"lengthM":5271,"sectors":null,"source":{"name":"bacinger/f1-circuits","url":"https://github.com/bacinger/f1-circuits/blob/master/circuits/au-1953.geojson","license":"MIT","upstreamId":"au-1953","note":"Centre-line only. No elevation, sector boundaries, race direction or start/finish index in the source."}}
