{"schemaVersion":1,"id":"shanghai","name":"Shanghai International Circuit","points":[[-86.6,-371.6],[-178.8,-394.7],[-215.9,-396.2],[-246.3,-385.2],[-262.6,-374.8],[-274.4,-364.2],[-283.4,-352.2],[-295.7,-323.9],[-295.7,-291.4],[-289.6,-265.7],[-282.2,-254.7],[-272.1,-245.2],[-249.6,-235.3],[-228.8,-235.3],[-212.5,-241.6],[-205.8,-248.9],[-201.2,-256.8],[-200.8,-267.8],[-212.5,-317.1],[-208.6,-327.1],[-199.1,-337.5],[-182.7,-343.8],[-164.8,-340.1],[-155.2,-333.9],[-143.4,-312.8],[-134.4,-283],[-133.2,-265.1],[-136.1,-250],[-151.3,-222.8],[-169.8,-200.2],[-219.3,-147.3],[-257.5,-97.5],[-328.3,-18.8],[-340.7,2.2],[-346.4,17.3],[-399.7,172],[-410.9,207.1],[-411.5,216],[-406.5,223.3],[-396.3,227.6],[-378.9,224.3],[-345.8,199.8],[-309.2,161.5],[-290.7,134.3],[-200.2,-21.4],[-170.4,-53.4],[-132.1,-70.8],[-111.9,-74.9],[-88.3,-74.9],[-67.5,-70.8],[-47.3,-63.4],[-27.1,-50.8],[-7.9,-35.1],[7.2,-17.3],[48.8,71.3],[59.6,87.6],[70.8,98.6],[105.6,115.9],[125.3,117.5],[142.2,115.9],[157.4,110.1],[170.9,101.2],[188.8,83.9],[230.4,3.2],[240.6,-7.8],[252.9,-11.5],[275.4,-5.2],[317,49.9],[322.6,60.9],[322.6,70.8],[319.2,80.8],[217.5,253.7],[84.2,471.7],[74.7,474.9],[65.2,472.3],[35.3,439.8],[25.8,433.5],[14,429.8],[1.6,431.9],[-10.7,442.9],[-25.4,459.2],[-32.7,472.3],[-37.1,484.3],[-39.4,502.2],[-35.4,534.1],[-30.4,548.8],[-16.9,566.6],[-4,576.6],[14,584.5],[48.3,590.2],[66.9,589.2],[91,583.4],[123.1,567.7],[145.5,546.7],[641.9,-209.1],[808.3,-455],[813.3,-466],[812.8,-476.4],[805.5,-483.8],[793.7,-482.7],[769.5,-471.2],[739.7,-449.7],[575.1,-224.8],[567.7,-220.7],[554.3,-219.6],[347.9,-268.4]],"lengthM":5447,"sectors":null,"source":{"name":"bacinger/f1-circuits","url":"https://github.com/bacinger/f1-circuits/blob/master/circuits/cn-2004.geojson","license":"MIT","upstreamId":"cn-2004","note":"Centre-line only. No elevation, sector boundaries, race direction or start/finish index in the source."}}
