{"schemaVersion":1,"id":"montreal","name":"Circuit Gilles Villeneuve","points":[[247.5,-285.6],[288.6,-475.9],[298.3,-535.6],[299.6,-584.9],[284.5,-717],[287.3,-732.8],[297.9,-742.7],[337.1,-760],[344.8,-765.8],[348.6,-777.2],[347.2,-788.8],[341.7,-800.4],[331.1,-809.3],[317.7,-814.5],[300.1,-814.5],[280.8,-810.3],[203.2,-786.7],[144.7,-751.5],[39.5,-658.3],[32.1,-646.8],[30.3,-637.3],[30.8,-627.9],[40,-593.9],[38.6,-583.3],[34,-574.4],[-41.2,-482.7],[-95.2,-440.8],[-111.8,-418.7],[-121,-395.2],[-127.5,-371],[-129.8,-351.7],[-129.3,-196.6],[-134.4,-187.1],[-143.6,-179.8],[-159.8,-176.1],[-193.9,-182.9],[-209.1,-178.7],[-231.2,-161.4],[-244.6,-140.4],[-251.6,-120.5],[-264.4,-65.5],[-274.2,69.7],[-273.2,129],[-267.7,229.1],[-256.6,303],[-217.9,459.1],[-211.4,473.4],[-202.2,479.1],[-167.2,485.9],[-156.5,492.2],[-145,504.3],[-136.2,518.4],[-128.4,537.8],[-90.1,693.4],[-74.9,777.8],[-69.8,837.1],[-68,917.8],[-70.3,938.7],[-99.4,1085.5],[-98.4,1092.8],[-92,1100.2],[-79.5,1102.3],[-71.6,1099.6],[-64.3,1088.2],[-54.5,994.3],[-48.5,977],[-10.3,898.9],[91.2,633.7],[231.4,-37.7],[230.1,-46.6],[224.1,-53.5],[213.4,-57.6],[206.5,-64.5],[203.7,-72.3],[204.2,-82.3],[228.7,-193.9]],"lengthM":4364,"sectors":null,"source":{"name":"bacinger/f1-circuits","url":"https://github.com/bacinger/f1-circuits/blob/master/circuits/ca-1978.geojson","license":"MIT","upstreamId":"ca-1978","note":"Centre-line only. No elevation, sector boundaries, race direction or start/finish index in the source."}}