{"schemaVersion":1,"id":"suzuka","name":"Suzuka International Racing Course","points":[[681,-137.6],[802,-283.3],[956.5,-475.1],[967.5,-511.5],[967.2,-528.4],[965.1,-541.4],[948.6,-592.4],[940.7,-605.8],[919.8,-621.3],[902.5,-625.5],[886.8,-625],[869.6,-619.2],[853.5,-606.5],[753.7,-453.6],[737.9,-440.2],[703.7,-432.3],[660.6,-432],[638.9,-425.7],[623.5,-414.9],[611.9,-400.8],[606.5,-387],[587,-313.2],[578.9,-294.3],[565.9,-278.1],[550.9,-267],[531.9,-258.2],[512.5,-254.5],[462.3,-253.7],[439.1,-249.3],[423.2,-241.7],[406.8,-229],[394.7,-211.3],[387.4,-193.3],[384,-176.3],[384.2,-160.1],[415.6,-65.2],[416.3,-47.2],[413.6,-35.3],[407.2,-18.1],[397.5,-3.4],[379,9.7],[329.7,35.4],[306.1,44.9],[264,53.9],[214.1,53.4],[195.7,48.5],[157.7,32.3],[133.3,18.6],[105.3,-4.3],[83.4,-27.5],[-13.5,-145.6],[-28.1,-149.1],[-162.7,-161.2],[-171.3,-160.1],[-180.5,-153.9],[-184.3,-143.3],[-206.4,-50.3],[-238.9,136.6],[-240.1,151.3],[-235.8,182.1],[-198.5,271.9],[-204.3,285.4],[-211.3,290.1],[-219.4,292.7],[-227.3,292.2],[-236.2,286.1],[-317.8,155],[-331.7,138.9],[-364.2,112.5],[-385.8,100.9],[-408.4,94.1],[-447.8,88.3],[-485.2,86.8],[-513.3,88.9],[-583.5,106.6],[-650.4,133.9],[-694.1,163.3],[-716.3,183.2],[-739.2,208.5],[-754.4,230.7],[-768,254.9],[-801.6,344.3],[-819.5,383.4],[-828.7,399.1],[-841.1,410.7],[-857.3,418],[-876.8,421.7],[-921.6,418],[-942.6,413.4],[-963.2,404.9],[-980,392.1],[-990.1,375.9],[-994,360],[-992.8,340],[-981.6,310.1],[-947.7,276.4],[-891.9,228.8],[-857,202.3],[-776.1,149.5],[-689.5,106.8],[-504.3,38],[-323.5,-22.3],[-180.5,-74.7],[-162.1,-79.4],[-143.8,-79.9],[-105.4,-71],[-71.4,-57.9],[-13.8,-26],[13.4,-4.9],[133.8,107.7],[153.2,123.7],[188.5,147],[199.7,144.8],[226.7,121.4],[236,118.7],[244.6,120.4],[254.8,127.1],[290.5,155.9],[311.6,164.8],[337.3,167.1],[361.3,165.7],[386.7,160.5],[433.6,140.3],[460.6,121.9],[484.9,99.3],[509.8,71.5]],"lengthM":5809,"sectors":null,"source":{"name":"bacinger/f1-circuits","url":"https://github.com/bacinger/f1-circuits/blob/master/circuits/jp-1962.geojson","license":"MIT","upstreamId":"jp-1962","note":"Centre-line only. No elevation, sector boundaries, race direction or start/finish index in the source."}}