{"schemaVersion":1,"id":"miami","name":"Miami International Autodrome","points":[[37.6,161.9],[242.8,33.8],[246.3,24.3],[244.8,15.5],[238.7,3.9],[195,-28.6],[181.4,-43.3],[176.9,-69.7],[181.4,-97.8],[177.1,-132.3],[166.6,-154.5],[127,-186.2],[81.9,-201.7],[52.6,-208.3],[9.4,-209.3],[-24.5,-203.2],[-64.2,-185.4],[-294.4,-47.2],[-326.2,-43.3],[-343.2,-45.5],[-364.8,-52.3],[-383,-62.5],[-421,-90.4],[-446.4,-94.6],[-469.3,-92.5],[-493.9,-80.6],[-538,-39.2],[-561.5,-27.5],[-585.8,-22.6],[-615.1,-27.7],[-642,-36.2],[-664.6,-46.8],[-681.3,-62.3],[-697.2,-87.2],[-703.4,-113.7],[-702.7,-135.8],[-697.8,-150.7],[-689.7,-160.9],[-673.2,-169.9],[-653.3,-169.9],[-628.7,-164.5],[-601.2,-164.6],[-440.8,-197.6],[-169.7,-187.7],[37.2,-257.2],[100.2,-267.8],[163.5,-268.6],[230,-257.7],[509.8,-155],[548.6,-137.8],[647.8,-85.1],[701.2,-50.9],[711.9,-36.5],[708.4,-24.5],[698.7,-15.1],[657.1,12.4],[647.8,31.1],[645.8,50.6],[651.3,74.3],[664.5,87.5],[680,93.7],[725.9,90.9],[748.8,94.1],[758.9,100.6],[774.3,115.6],[798.1,158.3],[796.5,167.7],[785,172.3],[774.5,180.1],[774.1,196],[793,257.3],[791.5,267.7],[783,274.7],[735.2,279.1],[45,303.5],[-505.3,328.5],[-521.4,324.2],[-524.8,311.5],[-519.3,295.8],[-470.5,256.3],[-438.6,239.2],[-412.6,232.6],[-389.7,234.5],[-361.7,244.6],[-296.4,275.3],[-259.8,285.1],[-214.8,289],[-170.4,282.7],[-128.5,265.3]],"lengthM":5415,"sectors":null,"source":{"name":"bacinger/f1-circuits","url":"https://github.com/bacinger/f1-circuits/blob/master/circuits/us-2022.geojson","license":"MIT","upstreamId":"us-2022","note":"Centre-line only. No elevation, sector boundaries, race direction or start/finish index in the source."}}