{"schemaVersion":1,"id":"silverstone","name":"Silverstone Circuit","points":[[68.4,774.6],[255,790.8],[288.1,788.8],[313.6,780.4],[330.2,769.3],[350,746.3],[362.5,720.1],[401.4,576],[409.9,515.2],[423.6,274.1],[435.4,245.2],[457.6,204.8],[467,181.8],[466.6,164.4],[462.5,144.1],[431,60.7],[428.9,27.1],[433.8,3.1],[445.1,-17.4],[476.3,-60.8],[483.5,-80.9],[484.3,-104.4],[479.1,-125.9],[460.1,-149.5],[435.8,-166.8],[376.8,-201.4],[358.5,-219.2],[337.5,-254.3],[69.3,-749.6],[-5.2,-865.4],[-26.2,-893.8],[-43.2,-908.9],[-63,-918.9],[-83.6,-924.2],[-123.7,-917.8],[-141.5,-910],[-157.3,-897.5],[-170.7,-877.5],[-194.9,-825.6],[-217.5,-786.3],[-258.4,-733.9],[-309.8,-679.9],[-383,-592.4],[-390.3,-587.7],[-400.4,-586.6],[-410.5,-591.4],[-441.2,-619.1],[-451.8,-622.8],[-471.2,-618],[-483.8,-606],[-513.7,-570.3],[-525.8,-546.8],[-534.3,-522.6],[-542.4,-484.4],[-540.3,-473.4],[-519.8,-439.8],[-246.2,-84],[-235.8,-71.8],[-217.5,-59.8],[-195.7,-54.6],[-177.9,-54.1],[-61.8,-69.3],[-38.3,-70.3],[12.7,-60.4],[34.5,-48.3],[176.9,64.9],[197.5,76.9],[209.2,78],[218.1,74.8],[226.2,67.5],[231.1,59.1],[255.4,-25.8],[262.7,-37.8],[272.7,-45.2],[284.5,-45.7],[297.5,-39.9],[310.8,-18.5],[320.9,9.3],[335.1,56],[338.3,78.5],[340.3,102.2],[338.7,126.7],[333.8,137.8],[321.3,151.9],[-140.3,573.3],[-170.2,590.1],[-191.6,593.2],[-213.9,590.7],[-236.5,579.6],[-244.7,569.6],[-250.3,555],[-259.6,478.5],[-264.9,462.8],[-276.2,450.1],[-293.2,441.8],[-311.8,439.1],[-332.4,444.4],[-347,454.3],[-355.9,465.9],[-362.8,479.5],[-364,494.1],[-361.1,509.9],[-290.4,653.5],[-271.3,676.1],[-226,718],[-204.2,733.2],[-152.8,752.6],[-102.2,758.9]],"lengthM":5877,"sectors":null,"source":{"name":"bacinger/f1-circuits","url":"https://github.com/bacinger/f1-circuits/blob/master/circuits/gb-1948.geojson","license":"MIT","upstreamId":"gb-1948","note":"Centre-line only. No elevation, sector boundaries, race direction or start/finish index in the source."}}