{"schemaVersion":1,"id":"monaco","name":"Circuit de Monaco","points":[[151.8,249.8],[150.2,259.8],[152.5,268.8],[163.7,289.8],[273.3,437.4],[282.2,439.9],[293.1,436.8],[300.6,430.6],[306.1,420.8],[308.3,393.2],[327.8,363.9],[336.9,344.4],[340.2,340.1],[345.4,338.6],[351.5,340.4],[356,345.1],[357.3,351.8],[324.1,391.7],[320.9,405.3],[325,415.1],[382.8,436.3],[396.6,437.3],[403.9,433.6],[406.7,422.3],[404.1,356],[393.9,287.8],[383.3,244.5],[371.5,213.6],[351.2,178.2],[327.9,148.3],[294.2,111.5],[245.9,81.9],[161.7,41.9],[124.4,29],[69.4,16],[15.2,6.8],[8.2,-14.4],[0.2,-17.2],[-11,-19.1],[-23.5,-12],[-30.3,-11.5],[-244.9,-42.1],[-250.9,-48.3],[-268.4,-85.1],[-274.9,-103.2],[-280.7,-138.6],[-280.5,-186.6],[-272.1,-199.5],[-251.3,-216.3],[-247.6,-224.6],[-227.3,-337.2],[-227.6,-343.3],[-231.2,-348.2],[-247.2,-357.7],[-249,-363.2],[-247.5,-374.9],[-230.1,-421.5],[-207.2,-458],[-189.1,-476.3],[-153.3,-494.3],[-149.5,-498.5],[-145.2,-511.6],[-147.3,-518.4],[-154,-522.5],[-200.7,-533],[-221.5,-531.8],[-231.5,-523.2],[-236,-497.8],[-252.9,-477],[-274.9,-442.2],[-285.1,-413.9],[-313.8,-310],[-323.8,-243.2],[-328.2,-191.8],[-328.2,-158.2],[-324,-105.8],[-310.6,-60.3],[-310.1,-29.2],[-307.4,-24.2],[-283.4,-16.7],[-192.7,-5.3],[-90.7,24],[-34.3,31.3],[58.2,71.7],[145.6,87.5],[160.4,92.7],[178.5,104],[194.2,120.4],[203,134.2],[206.9,148.6],[203.7,178],[190.6,208.5],[157.1,238.1]],"lengthM":3321,"sectors":null,"source":{"name":"bacinger/f1-circuits","url":"https://github.com/bacinger/f1-circuits/blob/master/circuits/mc-1929.geojson","license":"MIT","upstreamId":"mc-1929","note":"Centre-line only. No elevation, sector boundaries, race direction or start/finish index in the source."}}
