{"schemaVersion":1,"id":"monza","name":"Autodromo Nazionale Monza","points":[[-413.9,-490.4],[-360.8,118.3],[-359,125.6],[-353.9,129.9],[-325.4,129.9],[-317.1,138.8],[-316.2,143.4],[-342,246.7],[-345.7,273.4],[-347.1,297.5],[-335.6,451.7],[-327.2,492],[-300.6,557.5],[-284.9,582.2],[-247.1,625.7],[-197.4,664.9],[-169.4,681.2],[-137.6,697],[-70.8,717.9],[-31.3,724.8],[167.1,742],[372,754.6],[383,763],[389.4,785.6],[396.8,796],[459.4,809.6],[680.8,883.5],[696.4,887.2],[711.2,887.2],[735.5,880.4],[754.4,868.3],[772.4,845.8],[777,833.7],[801.9,587.4],[801.4,574.3],[795.4,558.5],[778.4,546],[475,378.3],[418.9,337.4],[293.7,229.4],[-33.1,-59.9],[-51.1,-81.4],[-52,-99.8],[-47.8,-151.1],[-53,-172.6],[-58.5,-186.7],[-67.6,-200.9],[-80.1,-215.6],[-111.8,-243.4],[-120.6,-270.1],[-140.4,-433.7],[-221.9,-1217.7],[-231.5,-1243.4],[-240.3,-1254],[-264.6,-1272.8],[-280.3,-1278.5],[-298.2,-1281.8],[-327.7,-1277.5],[-360.4,-1263.9],[-386.6,-1244.5],[-402.7,-1227.2],[-423.4,-1194.7],[-439.5,-1152.8],[-445.5,-1130.2],[-451.5,-1081.5],[-454.8,-921],[-453.8,-868.7],[-425.3,-583]],"lengthM":5784,"sectors":null,"source":{"name":"bacinger/f1-circuits","url":"https://github.com/bacinger/f1-circuits/blob/master/circuits/it-1922.geojson","license":"MIT","upstreamId":"it-1922","note":"Centre-line only. No elevation, sector boundaries, race direction or start/finish index in the source."}}
