{"schemaVersion":1,"id":"spielberg","name":"Red Bull Ring","points":[[232.3,-372.5],[-67.6,-453.5],[-82.3,-454.6],[-92.2,-445.7],[-108.7,-413.7],[-217.8,-262.3],[-262.4,-191],[-303.2,-120.7],[-388.1,63.2],[-416.3,108.8],[-459.6,161.8],[-598.2,300.7],[-602.2,309.6],[-601.7,319.1],[-594.1,323.7],[-522.2,333.2],[-411.3,334.7],[-357.7,329.5],[-295.5,319.5],[-105.6,282.8],[-18.9,271.4],[168.4,263.5],[183.6,258.2],[193,247.8],[196.5,236.2],[195.6,224.1],[190.7,212.7],[157.2,168.1],[129.9,143.9],[100,127.7],[63.8,115.7],[24.4,109.4],[-16.6,112],[-176.2,137.7],[-197.7,135],[-215.1,128.8],[-230.3,118.2],[-243.7,104.1],[-252.2,87.3],[-256.7,69],[-257.5,52.2],[-254.9,33.8],[-250,20.3],[-172.7,-114.9],[-159.7,-129.2],[-139.1,-142.2],[-115.4,-147.5],[-92.6,-145.4],[-68.5,-135.4],[-53.7,-123.4],[-24.3,-86.1],[-9,-70.5],[9.3,-57.9],[30.7,-45.2],[60.7,-34.2],[92,-27.4],[550.1,-18],[569.8,-24.9],[585.9,-36.9],[598.8,-53.1],[608.6,-74.6],[649.8,-217.7],[643.1,-233.5],[607.8,-257.5],[552.4,-283.2],[517.5,-294.7]],"lengthM":4302,"sectors":null,"source":{"name":"bacinger/f1-circuits","url":"https://github.com/bacinger/f1-circuits/blob/master/circuits/at-1969.geojson","license":"MIT","upstreamId":"at-1969","note":"Centre-line only. No elevation, sector boundaries, race direction or start/finish index in the source."}}