{"schemaVersion":1,"id":"zandvoort","name":"Circuit Zandvoort","points":[[-340.1,80.2],[-189.8,440.1],[-180.4,450.8],[-167.7,456.8],[-153.9,458.6],[-141.1,455.9],[-129,447.7],[-120.6,437.3],[-116.1,424.4],[-115.8,410.1],[-162.3,298.1],[-173.4,259],[-177.9,218.2],[-175.6,179.9],[-179.1,164.4],[-187.6,153.9],[-204.6,140.1],[-273.3,113.2],[-286.2,103.4],[-290.2,76],[-285,62.7],[-275.2,53.3],[-263,48.3],[-244.3,48.7],[-151.9,78.2],[-109,86.2],[-72.1,87.4],[-39.3,85],[-8.4,79.7],[49.8,65.3],[83.1,62.4],[135.1,74.7],[169.3,92],[209.5,118.2],[236.7,131.1],[261,138.1],[292.9,141.7],[423.1,134.7],[447.3,129.1],[469.8,117.9],[485.7,104.2],[505.9,73],[511.2,53.7],[512.9,33.4],[511,13.5],[505.2,-6.8],[492.6,-28.8],[444.3,-94.6],[426.5,-123.9],[386.2,-210.9],[366.9,-217.7],[343,-220.5],[293.2,-214.8],[265.2,-205.2],[235.3,-190.9],[205.6,-169.8],[187.3,-149.4],[184,-137],[186.9,-123.9],[198.3,-107.4],[214.6,-96.9],[238.6,-88.2],[279.5,-81.7],[318.9,-71.8],[354.9,-58],[374.8,-44],[382.3,-27.2],[383.3,-8.9],[376.9,9.4],[360.2,25.9],[345.3,31.2],[267.7,40.6],[189.6,40.4],[106.6,30.4],[36.5,12.7],[-54.9,-18.8],[-100.7,-38.2],[-151.7,-66.3],[-161.5,-64.4],[-180.4,-33.2],[-193.9,-24.9],[-211.1,-24.2],[-227.9,-32.1],[-236.9,-44.2],[-241,-57.2],[-199.3,-303.2],[-198.5,-317.9],[-202.6,-332.9],[-215.7,-353.7],[-231.7,-364.5],[-248.7,-368.4],[-335.6,-368.8],[-357.1,-365.5],[-379.3,-358.3],[-397.5,-349.9],[-421.8,-330.8],[-448.4,-291.5],[-456.3,-267.1],[-458.8,-245.6],[-456.6,-210.6],[-449.9,-185.7],[-345.8,67.1]],"lengthM":4255,"sectors":null,"source":{"name":"bacinger/f1-circuits","url":"https://github.com/bacinger/f1-circuits/blob/master/circuits/nl-1948.geojson","license":"MIT","upstreamId":"nl-1948","note":"Centre-line only. No elevation, sector boundaries, race direction or start/finish index in the source."}}