{"schemaVersion":1,"id":"marina-bay","name":"Marina Bay Street Circuit","points":[[681.9,116.1],[713.1,-129.4],[710.4,-143.3],[661.1,-218.1],[646,-222.3],[537.4,-216.4],[399.8,-201.7],[382.3,-197.1],[371.3,-190.5],[362.6,-181],[355.4,-162.1],[355,-132.3],[351.4,-126.5],[-75,-103.7],[-109.6,-99.6],[-133.8,-93.1],[-158.7,-80.7],[-310.7,51.2],[-321,52.8],[-333.9,50.5],[-349.9,37.8],[-368.3,-18],[-452.1,-441],[-458.5,-451],[-465.4,-456],[-473.7,-457.9],[-488.5,-455.8],[-511.8,-424.4],[-520.5,-405.6],[-573.8,-361.2],[-609.4,-327.7],[-617.9,-315.8],[-626.4,-286.8],[-622.7,-262.9],[-616.7,-250.9],[-619.9,-243.3],[-651.4,-232.5],[-690.6,-206.2],[-707.2,-191.5],[-713.2,-179.1],[-716,-161.8],[-716.7,-146.6],[-528.4,190.3],[-507.8,208.6],[-487.8,212.6],[-447.8,186.1],[-355.8,89.7],[-347.6,85.5],[-340.8,87.2],[-298.2,170.1],[-249.8,252.2],[-240.9,265.4],[-232.3,268.5],[-216.9,261.6],[49.9,107.2],[92.1,91.1],[121.3,85.6],[485,64.2],[499.2,66.9],[517.5,75.5],[532.6,86.2],[542.3,103.9],[544.7,120.6],[542,160.6],[531.5,214.8],[485.6,336.6],[482.5,355.5],[482.5,379.7],[487.8,433.7],[497,454.9],[509.7,467.7],[520.4,468.7],[530.1,466.1],[552.1,438.6],[562.1,430.1],[585.1,418.8],[604.4,413.4],[628.7,415.8],[641.1,410.8],[647.5,401.9],[651.1,387.6],[660.9,268]],"lengthM":4942,"sectors":null,"source":{"name":"bacinger/f1-circuits","url":"https://github.com/bacinger/f1-circuits/blob/master/circuits/sg-2008.geojson","license":"MIT","upstreamId":"sg-2008","note":"Centre-line only. No elevation, sector boundaries, race direction or start/finish index in the source."}}
